text,label,label_text
US house sales fall in July Sales of non-new houses in the US fell last month but still exceeded analyst forecasts.,2,Business
"DJ to acquire MarketWatch Dow Jones  amp; Co., publisher of the Wall Street Journal, says it has agreed to buy online news site MarketWatch Inc. in a \$519 million deal that widens its Internet audience.",2,Business
"Dollar hits new low on Snow speech The United States supports a  quot;strong dollar, quot; Treasury Secretary John Snow said, while suggesting the Bush administration will not act to boost its value. His comments sent the currency plunging to a record low against the euro.",2,Business
Yukos executives 'flee' Russia All the top executives at Russian oil giant Yukos have fled the country in fear of arrest as the government seeks to sell off its main asset.,2,Business
"Smithfield quarterly profits beat outlook SMITHFIELD, Va. Meat processor Smithfield Foods says its income more than doubled in the most recent quarter. The company cites improved profitability in the hog production segment, combined with strong results ",2,Business
"Morgan Stanley cracks in 3Q Investment bank misses estimates as trading income plunges, other units fail to pick up the slack. By Rob Cox, Breakingviews. LONDON (Breakingviews) - Morgan Stanley is the first to slip.",2,Business
"ING Names Business Units in Trade Woes ING Groep NV has disclosed new details of trading improprieties in its mutual funds and variable-insurance products, but research firm Morningstar Inc.",2,Business
"Lennar Profit Up 12 Pct, Shares Fall Home builder Lennar Corp. (LEN.N: Quote, Profile, Research) on Monday reported a 12 percent rise in quarterly profit and raised its forecasts for the current and following year, citing a stable economy.",2,Business
"US manufacturing activity picks up, construction surges to record &lt;b&gt;...&lt;/b&gt; US manufacturing activity remained strong in September and construction spending surged to a record high in August, according to a pair of reports issued Friday that provided an optimistic look at the sturdiness of the economy.",2,Business
"Ottawa Says Time to Stop Protecting Air Canada The Canadian government, in a radical shift, said on Friday it was time to stop protecting national carrier Air Canada as it mulled whether to lift foreign ownership restrictions on the country #39;s airlines.",2,Business
Russia Delays Review of Yukos Subsidiary Licenses Russia #39;s Natural Resources Ministry has postponed consideration of whether to suspend the licenses of the main subsidiary of the troubled giant oil firm Yukos.,2,Business
"National union leaders set a timeline for change November 11, 2004. WASHINGTON -aced with the impact of labor #39;s political loss on Nov. 2, the AFL-CIO Executive Council decided on Nov. 10 on a timeline for changes in the union movement ",2,Business
"BA launches inquiry The chief executive of British Airways, Rod Eddington, says he will carry out an investigation into the staff shortages that caused flight cancellations this week.",2,Business
FT gets Collins Stewart claim struck out The Financial Times today won its action to strike out a record 230.5m libel damages claim from City brokers Collins Stewart that could have closed down the pink paper.,2,Business
"Things better without Conway? PeopleSoft Inc., in the midst of fighting a takeover bid from Oracle Corp., is  quot;in better shape quot; because of the departures of Chief Executive Craig Conway and a senior technology official, a director testified.",2,Business
Bank of Montreal to acquire Indiana-based institution Toronto (Dow Jones) -- Bank of Montreal on Wednesday said it agreed to acquire Mercantile Bancorp Inc. for \$156.5 million as it moves to expand in the Midwest region of the United States.,2,Business
Vodafone 'OKs Verizon Sprint bid' US telecoms firm Verizon is reported to have won the backing of mobile partner Vodafone for a bid for US rival Sprint.,2,Business
"Third Quarter Gannett Earns Up 11 Percent NEW YORK - Gannett Co., the largest newspaper publisher in the country, reported an 11 percent increase in third-quarter earnings Tuesday on gains in advertising, particularly classified real estate and help-wanted ads.",2,Business
"Samsung Faces Concerns Over Margins  SEOUL (Reuters) - Concern over falling profit margins at  Samsung Electronics Co. Ltd. grew on Thursday as the company  said it was spending more on handset marketing and a top broker  issued a ""sell"" rating on its stock for the first time in  years.",2,Business
"Wall Street Faces 2 Elections, Not Just 1 (Reuters) Reuters - The waiting game for the U.S.\presidential election ends two weeks from Tuesday -- but then\investors can turn over the timer and start again.",2,Business
"Indian Central Bank Raises Key Rate to Curb Prices (Update2) India #39;s central bank unexpectedly raised a key interest rate for the first time in four years, saying record oil prices and rising corporate demand for credit threaten to fuel inflation.",2,Business
Coke is it: BHP coal to double BHP Billiton plans an aggressive \$US1.5-2 billion (\$2.1-2.8 billion) near-doubling of its coking coal production over the next five years to meet the China-inspired surge in demand for carbon steel-making materials through mine expansions and developments ,2,Business
Video game giants roll out products Nintendo Co. and Sony Corp. made separate product announcements Tuesday that the video game giants hope will attract more customers ahead of the highly competitive holiday shopping season.,2,Business
"Oil prices up on Yukos woes NEW YORK -- Oil prices broke above \$46 yesterday after Russian oil giant Yukos said it would cut some oil shipments to China, the first toll on exports from the company's financial turmoil.",2,Business
"Australia #39;s S amp;P/ASX 200 Falls; Origin Declines, Woodside Climbs Australia #39;s S amp;P/ASX 200 Index fell for a third day. Origin Energy Ltd. declined after New Zealand #39;s Contact Energy Ltd.",2,Business
Harmony Grabs Hold of Gold Fields HARMONY is set to become the world #39;s biggest gold producing mining company in just four months. This week Harmony moved closer to successfully concluding its hostile bid for rival Gold Fields.,2,Business
"UPDATE 2-Blockbuster cuts online price, challenges Netflix Video chain Blockbuster Inc (BBI.N: Quote, Profile, Research) on Friday said it would lower the price of its online DVD rentals to undercut a similar move by Netflix Inc.",2,Business
Twinkies maker in crisis There #39;s an old saying in the business world when a sale seems all but assured: It was as easy as selling Hostess Twinkies. That may no longer be true.,2,Business
"Revlon 3rd-Quarter Loss Widens  CHICAGO (Reuters) - Cosmetics maker Revlon Inc. &lt;A HREF=""http://www.investor.reuters.com/FullQuote.aspx?ticker=REV.N target=/stocks/quickinfo/fullquote""&gt;REV.N&lt;/A&gt; on  Wednesday said its third-quarter net loss widened on  refinancing costs and declining sales.",2,Business
"BAE buys Pentagon contractor British defense firm BAE Systems has agreed to pay \$600 million (333.7 million pounds) for DigitalNet Holdings, a maker of secure Pentagon computer networks, the companies say in a weekend statement.",2,Business
"US Newspapers and their Audience USA Today is read by people who think they ought to run the country but dont really understand the Washington Post. They do, however, like their smog statistics shown in pie charts.",2,Business
Yukos files for bankruptcy protection in Bush #39;s backyard Russian oil giant Yukos yesterday increased the stakes in its battle with the Kremlin when it filed for bankruptcy in the United States in an unusual move possibly intended to pitch Washington against Moscow.,2,Business
"Study May ID Source of Vioxx Problem Nov. 11, 2004 -- A private research team claims to have identified a unique action of the painkiller Vioxx, which is independent of its anti-inflammatory action, that might explain why it #39;s linked to heart ",2,Business
European Shares Tread Water  LONDON (Reuters) - European shares traded sideways on  Wednesday but banks were a bright spot as Britain's HBOS  rallied on relief it would not be wading into a bidding war for  domestic peer Abbey.,2,Business
Oil Climbing Back Up After Supply Report  LONDON (Reuters) - Oil prices rebounded from seven-week  lows on Wednesday as U.S. heating oil stocks fell for an eighth  straight week ahead of winter.,2,Business
Asian telecom firms come together Seven Asian telecommunications firms are coming together to invest between \$30m and \$40m (16.3m and 22m) in new mobile phone services and technology.,2,Business
"Employers Add 112,000 New Jobs in Nov. Employers slowed their hiring as they headed into the holiday shopping season, adding just 112,000 new jobs in November for the weakest gain in five months.",2,Business
"Amazon.com, Microsoft sue spammers,  #39;phishers #39; Amazon.com Inc. and Microsoft Corp. have filed several lawsuits in various Seattle courts aimed at computer spammers and  quot;phishers quot; who use a look-alike Amazon.",2,Business
Boston Scientific to Offer Senior Notes Medical device maker Boston Scientific Corp. on Monday said it is launching a public offering of two series of its senior notes to repay commercial paper borrowings and for general corporate purposes.,2,Business
"KPMG Units Agree to Pay to Settle Malpractice Suits The American and Belgian arms of KPMG International, a global accounting cooperative based in Switzerland, have agreed to pay \$115 million to settle claims of accounting malpractice growing ",2,Business
"A cure for shortage? It #39;s too late for this year #39;s flu season, but a Canadian drug company yesterday said it has agreed to provide influenza vaccines to Henry Schein Inc.",2,Business
"US Stocks Up Slightly After Ford Forecast  NEW YORK (Reuters) - U.S. blue chips edged higher on   Friday after Ford Motor Co. &lt;A HREF=""http://www.investor.reuters.com/FullQuote.aspx?ticker=F.N target=/stocks/quickinfo/fullquote""&gt;F.N&lt;/A&gt; raised its earnings  forecasts, but wireless technology provider Qualcomm Inc.  &lt;A HREF=""http://www.investor.reuters.com/FullQuote.aspx?ticker=QCOM.O target=/stocks/quickinfo/fullquote""&gt;QCOM.O&lt;/A&gt; held back the Nasdaq after saying an accounting review  may reduce pretax income.  ",2,Business
"Oracle #39;s next fight seen at boardroom LOS ANGLES (CBS.MW) - Following its latest rejection, the next stage in Oracle Corp #39;s battle to buy PeopleSoft is set to begin in a courtroom on Wednesday.",2,Business
"VW and unions begin a new round of talks HANNOVER, Germany Senior negotiators from Volkswagen and its main union entered another round of negotiations on Tuesday as they worked to reach a cost-cutting contract and head off the first comprehensive strike at the automaker #39;s factories in western ",2,Business
"U.S. Stocks Slip as Profit Warnings Weigh  NEW YORK (Reuters) - U.S. stocks slipped on Wednesday after  several companies issued profit warnings, while Fed Chairman  Alan Greenspan's remarks that the economy was pulling out of a  summer soft patch did little to quell expectations for a rate  hike later this month.",2,Business
"Jeremy Warner #39;s Outlook: Is anyone safe as Spitzer takes aim at &lt;b&gt;...&lt;/b&gt; Is no one safe from Eliot Spitzer #39;s accusing finger? After the investment banking, fund management and pharmaceuticals industries comes the insurance sector, which in a suit filed by the New York attorney ",2,Business
"U.S. Oil Clings Near \$47  SINGAPORE (Reuters) - U.S. oil prices hovered near \$47 a  barrel on Wednesday, awaiting data that was expected to show a  big drop in fuel stocks in the United States due to  weather-related disruptions to output and shipments.",2,Business
"Rentokil rules out break-up Rentokil Initial, supplier of services ranging from security guards and pest control to conferences and exotic plants, has ruled out breaking itself up, despite tumbling profits and a swirl of takeover speculation.",2,Business
HHG gets out of red zone AMP spin-off HHG plc has produced a pound stg. 46 million (\$A117 million) profit for the six months to June 30 - a massive turnaround from the pound stg.,2,Business
"Stocks Drop on \$49 Oil, Slowing Economy  NEW YORK (Reuters) - U.S. blue-chip stocks fell  on  Thursday to nearly a five-week low as crude oil touched \$49 a  barrel, close to the record set last month, and a key gauge of  future economic activity fell for a third straight month.",2,Business
"Sun Micro Aims to Woo Banking Customers (Reuters) Reuters - Sun Microsystems Inc.  is\staging its first press and customer event in New York on\Tuesday in three years to roll out new products and woo\customers in the banking industry, one of the network computer\maker's most important markets.",2,Business
"Abbey top job for Santander man The new owners of Abbey National, Banco Santander Central Hispano, yesterday appointed their own man to head up their 9.1bn acquisition and pledged not to close any of Abbey #39;s 740 branches.",2,Business
"Ryanair Could Profit with High Oil - CEO (Reuters) Reuters - Europe's biggest no-frills\airline, Ireland's Ryanair Holdings Plc , will turn a\profit even if oil prices hit  #36;75 a barrel, Chief Executive\Michael O'Leary was quoted saying on Sunday.",2,Business
"Bank of America to Cut 4,500 More Jobs The Bank of America Corporation said yesterday that it would cut an additional 4,500 jobs from its ranks, beginning this month, as it simplifies operations.",2,Business
Treasuries Trim Gains After GDP Data (Reuters) Reuters - Treasury debt prices trimmed early\gains on Friday after U.S. economic data proved to be not quite\as weak as some bulls had been betting.,2,Business
"Jukebox is reborn for the Internet age The Internet has changed the way people listen to music in their personal space. (Think iPod and other portable music players.) Now, it's also changing the way people listen to music in public places, such as restaurants and bars.",2,Business
"US Job Cuts Steepest in Eight Months up 45 percent from August -- according to a survey released by the outplacement firm Challenger, Gray and Christmas. Compared with a year ago, job cuts were up 41 percent.",2,Business
Dollar Slumps After Weak U.S. Data  NEW YORK (Reuters) - The dollar sagged on Tuesday as softer  U.S. data on Tuesday re-ignited worries that the world's  largest economy has yet to recover from its recent soft patch.,2,Business
"Stocks Rise; Healthcare Sector Climbs  NEW YORK (Reuters) - U.S. stocks rose on Wednesday, a day  after a sharp sell-off, as value investors picked up shares in  lagging sectors such as healthcare.",2,Business
US Air Pilots to Vote on Pay-Cut Proposal  WASHINGTON (Reuters) - Bankrupt US Airways took a crucial  step toward securing \$300 million in concessions from its  pilots union late on Tuesday when leaders of the labor group  said they would forward a plan to cut wages and benefits to all  pilots for a vote.,2,Business
"No relief as IMF and World Bank talks on poor end in failure THE worlds leading finance officials and ministers yesterday failed to reach agreement on debt relief for the poorest nations. Wrapping up a weekend of IMF and World Bank talks in Washington, no agreement appeared to have been secured.",2,Business
"PeopleSoft Ousts CEO in Oracle Battle In Oct 1 story headlined  quot;PeopleSoft Ousts CEO Amid Oracle Battle, quot; please read in paragraph 16 ... originally offering \$16 a share ... instead of ... originally offering \$19.50 a share ... By Michael Kahn and Martha Graybow.",2,Business
How Millionaires are Born There's hope for the next generation when teens begin investing their money.,2,Business
"Oracle victorious in quest for PeopleSoft It #39;s finally over. Business-software maker PeopleSoft (PSFT) agreed to be acquired by rival Oracle (ORCL) for \$10.3 billion Monday, ending 18 ",2,Business
"Despite Mega-Deals, Small Mergers Rule  Philadelphia (Reuters) - Despite the euphoria of one of the  busiest weeks in U.S. mergers and acquisitions in almost five  years, Wall Street investment bankers cannot live by mega-deals  alone.",2,Business
"UPDATE 2-GE sells India back office unit stake for \$500 mln General Electric Co. (GE.N: Quote, Profile, Research) , the world #39;s top conglomerate, said on Monday it had sold a majority of its pioneering Indian back ",2,Business
The Health Care Clash Moves to the Next Aisle Supermarkets face a new showdown as labor unions determined to keep health benefits spar with management trying to compete with Wal-Mart.,2,Business
"Halliburton says profit in Iraq is weak HOUSTON Halliburton, the oil services company once run by Dick Cheney, the US vice president, reported on Tuesday a quarterly loss and only meager pickings from its vast operations in Iraq.",2,Business
"Adobe Posts Sharp Rise in Profit  NEW YORK (Reuters) - Adobe Systems Inc. &lt;A HREF=""http://www.investor.reuters.com/FullQuote.aspx?ticker=ADBE.O target=/stocks/quickinfo/fullquote""&gt;ADBE.O&lt;/A&gt; on Monday  reported a sharp rise in quarterly profit, driven by robust  demand for its Photoshop and document-sharing software.",2,Business
"No go for Mitsubishi Fuso buses because of faulty seats TOKYO - Japan #39;s Transport Ministry has urged bus operators across the country to idle all buses made by scandal-hit Mitsubishi Fuso Truck and Bus Corporation, after passengers were injured by faulty seats that suddenly broke away from the floor.",2,Business
"AT amp; Wireless unveils messaging-only handheld AT amp;T Wireless on Monday seemed to be trying to turn back the clock on cell phone design trends when it introduced the Ogo, a messaging-only handheld.",2,Business
"Vivendi Flashes V for Victory Vivendi (NYSE: V) is one of those complex behemoths of a firm that normally doesn #39;t make it onto my radar since, as a lazy Fool, I prefer my companies small and simple.",2,Business
Hardie feels boycott pain ASBESTOS-RELATED boycotts of James Hardie products have forced the controversial building products maker to slash its profit forecast.,2,Business
"Fireman's Fund says it will keep insuring autos in Mass. Fireman's Fund Insurance Co., apparently swayed by recent meetings with a Massachusetts regulator, reversed course yesterday and said it now plans to continue writing auto insurance policies in the state next year.",2,Business
"Federal tax staff strike over wages OTTAWA -- About 8,000 employees of the federal tax agency walked off the job yesterday in Ontario and BC, including 280 in London, leaving public phone queries unanswered and federal revenue cheques uncashed.",2,Business
LA parking company lands contract renewal with ABIA Los Angeles-based Ampco System Parking has received a multi-year contract renewal with Austin-Bergstrom International Airport. ,2,Business
"services will make cash flow, says Vodafone Vodafone, the world #39;s largest mobile phone company, believes it can generate an extra 2.5 billion in cash every year by reducing costs and getting customers to spend more on their phones.",2,Business
"Dutch bank to lay off 2,850 staff ABN Amro, the Netherlands #39; largest bank, is to cut 2,850 jobs as a result of falling profits. The cuts - amounting to 3 of the bank #39;s workforce - will result in a one-off charge of 790m euros (\$1.1bn).",2,Business
Circulation investigation hits Times A wide-reaching federal investigation into newspaper circulation practices has knocked on the door of a fourth New York daily - The New York Times.,2,Business
"Consumer Price Index up 0.6 in Oct. (Washington-AP) Nov. 17, 2004 - The Labor Department #39;s Consumer Price Index shows a larger-than-expected gain, but combined with Thursday #39;s reading on wholesale inflation, analysts say the picture is one where ",2,Business
Artificial trees grow on Americans More and more Americans are waking up Christmas morning to find Santa #39;s presents nestled under the plastic branches of an artificial tree.,2,Business
"ATA Files for Bankruptcy  LOS ANGELES (Reuters) - ATA Holdings Corp. &lt;A HREF=""http://www.investor.reuters.com/FullQuote.aspx?ticker=ATAH.O target=/stocks/quickinfo/fullquote""&gt;ATAH.O&lt;/A&gt;, parent  of struggling low-cost carrier ATA Airlines, on Tuesday filed  for Chapter 11 bankruptcy protection as falling fares and  soaring fuel prices drained it of cash.",2,Business
"Update 8: Yukos Removes Anti-Crisis Plan From Agenda Shareholders of the foundering Russian oil giant Yukos will not vote on an anti-crisis plan at a Dec. 20 meeting, the company said in a statement Friday, saying the plan would be impossible to implement in ",2,Business
"Jury rules 9/11 was two attacks Attaching victory to a string of defeats, a jury yesterday agreed with World Trade Center developer Larry Silverstein #39;s claim that the planes that struck the Twin Towers represented two separate, insurable events.",2,Business
"Stocks Drop on \$49 Oil, Slowing Economy US blue-chip stocks fell on Thursday to nearly a five-week low as crude oil touched \$49 a barrel, close to the record set last month, and a key gauge of future economic activity fell for a third straight month.",2,Business
"IBM to Expand Data Centers Across World  SAN FRANCISCO (Reuters) - IBM is expanding and adding new  technology to 11 of its data centers in North America, Europe  and Asia to meet growing demand and rolled out new services to  customers, the world's largest computer company said late on  Thursday.",2,Business
"Knight Steps Down as Nike Chief Phil Knight stepped down Thursday as president and chief executive officer of Nike Inc., the athletic shoe and clothing company he co-founded.",2,Business
"BA, Virgin to up fuel surcharge British Airways and Richard Branson #39;s Virgin Atlantic Airways say they will raise fuel surcharges following similar moves by major European carriers this week as oil prices surged.",2,Business
"Denver storm covers roads in ice, knocks out power. DENVER - A Halloween storm gave the Denver metro area its first taste of snow for the fall, and dumped even more white gold on top of snow that had already fallen at Colorado #39;s mountain ski resorts.",2,Business
"300,000 seek 3,000 dockworker jobs LOS ANGELES  Longshore union and port shipping officials yesterday sifted through 300,000 applications submitted as part of a special lottery for 3,000 lucrative temporary dockworker jobs at the nation #39;s largest port complex. ",2,Business
"Google Raises \$1.67 Bln in Cut-Price IPO NEW YORK/SAN FRANCISCO (Reuters) - Google Inc., the most popular Internet search engine, raised \$1.67 billion on Wednesday in its long-awaited IPO after slashing the price and size of an offer beset by missteps and ...",2,Business
"ADV: Forex Trading: The New Financial Account Get real-time rates, free charts and news, as well as a free demo trading account from FXCM - the market maker for Forex trading. Visit the site today.",2,Business
"Penn National buys Argosy Gaming Co. Argosy Gaming Co., the owner of Sioux City #39;s riverboat casino, has been sold to Penn National Gaming Inc. in a \$1.4 billion deal that would create the nation #39;s third-largest operator of casinos.",2,Business
"Telstra in \$750m buyback By staff writers and wires. THE nationn #39;s biggest telco, Telstra Corp, is offering shareholders up to \$4.65 per share in a off-market buyback worth \$750 million.",2,Business
PayPal and Apple iTunes link-up Payment system Paypal announces a tie-up with Apple's iTunes as it continues to secure new business with online retailers.,2,Business
Shares in easyJet fall to all-time low EasyJet #39;s bumpy ride continued yesterday as shares in the no-frills airline hit an all-time low after it warned that fares will remain under pressure next year.,2,Business
"Disney's Eisner Sees Iger as Successor  LOS ANGELES (Reuters) - Walt Disney Co. Chief Executive  Michael Eisner said company President Robert Iger is his  ""preferred choice"" to succeed him in running the entertainment  conglomerate, according to an interview in Sunday's Los Angeles  Times.",2,Business
"I was kept in the dark: Anil Anil Ambani has written to his brother Mukesh, saying his powers as vice-chairman and managing director of Reliance Industries have been diluted by  quot;keeping him completely in the dark quot;.",2,Business
"Administration cuts job growth forecast The Bush administration, after being ridiculed by Democrats for an overly optimistic jobs forecast this year, yesterday significantly reduced its forecast for new jobs that will be created in 2005. It slightly boosted its estimate for overall economic growth.",2,Business
"China Aviation Oil Says Still in Business The main supplier of jet fuel to China is continuing to do business despite a criminal investigation of its US\$550 million (euro414 million) in losses on derivative trading, the company said.",2,Business
"Walgreen Profit Rises 30.5 Pct, Shares Up  CHICAGO (Reuters) - Walgreen Co. &lt;A HREF=""http://www.investor.reuters.com/FullQuote.aspx?ticker=WAG.N target=/stocks/quickinfo/fullquote""&gt;WAG.N&lt;/A&gt; on Monday posted a  30.5 percent rise in quarterly profit, boosted by sales of  generic drugs and digital photo processing, sending its shares  to a nearly three-year high.",2,Business
"Update 2: Volkswagen, Workers Renew Wage Talks Wage negotiations between Volkswagen AG and Germany #39;s biggest industrial union broke up without agreement Thursday, but the two sides agreed to hold more talks next week even as the union presses ahead with plans for a flurry of short work stoppages.",2,Business
"Wachovia Profit Rises 14 Percent Wachovia Corp. (WB.N: Quote, Profile, Research) , the No. 5 US bank, on Friday said third-quarter profit rose 14 percent, helped by increased lending to consumers and a decline in bad loans.",2,Business
