text,label,label_text
"Before the Bell - Nastech Soars 23 Pct.  NEW YORK (Reuters) - Shares of Nastech Pharmaceutical Co.  Inc. &lt;A HREF=""http://www.investor.reuters.com/FullQuote.aspx?ticker=NSTK.O target=/stocks/quickinfo/fullquote""&gt;NSTK.O&lt;/A&gt; jumped 23 percent before the bell on Monday after  the company said it tied up with Merck   Co. &lt;A HREF=""http://www.investor.reuters.com/FullQuote.aspx?ticker=MRK.N target=/stocks/quickinfo/fullquote""&gt;MRK.N&lt;/A&gt; to develop  and market Nastech's experimental nasal spray treatment for  obesity.",2,Business
"2 telltale signs that show it #39;s time to dump a stock The last time I looked, shares of discount retailer 99 Cents Only were trading at \$14 or so, down around 60 percent from their summer 2003 mid- \$30 trading range.",2,Business
"Intel announces milestone in shrinking chips SAN JOSE, Calif. Semiconductor company Intel says it has made a breakthrough development in shrinking the size of chips. The Santa Clara-based company announced today it has created a fully functional 70 megabit ",2,Business
"Stock Markets Fall as Oil Nears \$50 a Barrel NEW YORK, Sept. 22 -- A surge in oil prices and a disappointing earnings report from Morgan Stanley were cited as factors in significant stock market losses Wednesday.",2,Business
"Delta Pilot Pay Cuts May Not Be Enough Delta Air Lines Inc. Chief Executive Gerald Grinstein yesterday said that even if the carrier #39;s pilots approve a \$1 billion cost-cutting agreement, the airline may still have to seek Chapter 11 bankruptcy protection.",2,Business
"Arthritis drug a heart attack risk, study finds United States drug giant Pfizer says a trial has found a sharp rise in heart attacks for patients using its blockbuster Celebrex arthritis and pain medicine.",2,Business
"Rates on 30-Year, 15-Year Mortgages Dip Rates on 30-year and 15-year mortgages dipped this week, a development that should help keep the housing market humming. Rates on 30-year, fixed-rate mortgages averaged 5.74 percent for the week ending Nov.",2,Business
"Salvation Army sees donation totals down Christmas may be the season for giving, but the Lancaster Salvation Army will not be receiving as much in donations as in past years.",2,Business
"Divorcee Gets Lesson in Finance (AP) AP - At first, Kristin Briggs felt mistrust. Not toward her husband, who wanted a divorce, but toward her new financial planner.",2,Business
EU raps Greece over deficit The European Union last night started legal action against Athens after it was revealed that a systematic under-reporting of Greece #39;s budget deficit should have ruled the country out of joining the single currency.,2,Business
"Report: Officials search Yukos managers #39; homes Russian authorities have searched the homes of dozens of managers working for the embattled Yukos oil company in what one board member described as a massive campaign reminiscent of the Stalinist purges, a news agency reported Sunday.",2,Business
"Nortel posts loss of 6 cents per share NEW YORK -- Nortel Networks Corp. reported a loss of 6 cents per share in the third quarter and predicted lower sales for 2004 than in 2003 on Tuesday, providing some of its first concrete figures for the ",2,Business
"U.S. Stocks Climb as Crude Falls  NEW YORK (Reuters) - U.S. stocks extended their gains on  Tuesday as oil prices slipped, easing concerns that energy  costs would hurt corporate profits and helped raise hopes for  improvement in the economy.",2,Business
"Gallaher profits up despite tough Europe Gallaher #39;s profits rose 4.4 percent in the first half as its improved prospects in Britain offset worsening trading conditions in continental Europe, the tobacco company says.",2,Business
"Mass. exports increase 19 in year Massachusetts exports grew at a record pace in the first nine months of the year, surging 19 percent from the same period the year before, Alliance for the Commonwealth, the research arm of Associated Industries of Massachusetts, reported. Through September, Bay State companies exported \$16.4 billion in goods to overseas markets, keeping them on pace to break the annual export ...",2,Business
Dollar Rebounds But Tone Is Wary on Jobs  NEW YORK (Reuters) - The dollar rebounded on Monday after  last week's heavy sell-off but analysts were uncertain if the  rally would hold after fresh economic data suggested the  December U.S. jobs report due Friday might not live up to  market expectations.,2,Business
Reasons to Like Four Seasons The luxury hotel manager doubles earnings for the second straight quarter.,2,Business
Microsoft Moves Closer to Wiping Its Antitrust Slate Clean By reaching antitrust settlements with two additional litigantsNovell Inc. and the Computer  amp; Communications Industry AssociationMicrosoft Corp.,2,Business
Apple iTunes 'overcharging in UK' The Office of Fair Trading refers Apple's iTunes service to the European Commission on the grounds that it over-charges UK customers.,2,Business
"Study Finds Accelerating Decline in Corporate Taxes merica #39;s largest and most profitable companies paid less in corporate income taxes in the last three years, even as they increased profits, according to a study released yesterday.",2,Business
"Berlusconi gets on early election footing (AFP) AFP - Italy's Prime Minister Silvio Berlusconi has put his centre-right government on an election footing by announcing a cut in income tax in a bid to win back voters' confidence, with polls still 18 months away.",2,Business
"Sprint will 700 Stellen im Verkauf und Support streichen Overland Park, 15.10.04 - Sprint Corporation announced it will record in its third quarter financial results a pre-tax non-cash impairment charge reducing the value of its long-distance network assets.",2,Business
"Fed Expected to Boost Rates Again The Federal Reserve, wanting to keep inflation at bay, is expected to boost short-term interest rates for a third time this year on Tuesday, a move that would come in the final stretch of the presidential campaign.",2,Business
"Bangladesh Is Surviving to Export Another Day Garment makers in poor countries have been dismayed over the upcoming abolition of trade quotas, but the outlook is not as bleak as many experts had thought.",2,Business
"Toys 'R' Us banks on strategy  With one week left until Christmas, customers can still find some of the season's hottest toys, like Dora's Talking House and Bella Dancerella, a ballet kit, at Toys ""R"" Us Inc. But it's a different story at rival Wal-Mart Stores Inc. , whose inventory of many of the popular items has been depleted.",2,Business
"House OK's \$136b in tax breaks  The House last night passed a sweeping rewrite of corporate tax law, a measure designed to end a trade war with Europe and shower \$136 billion in new tax breaks on businesses, farmers, and other groups.",2,Business
"Local Chain Rolling Out D.C. Tabloid Journal Newspapers Inc. plans to begin distributing a free daily newspaper in the District on Feb. 1, according to one of its major advertisers and a source close to the company.",2,Business
U.S. Stocks Rebound on Retail Sales  NEW YORK (Reuters) - U.S. stocks rose on Friday as a  bigger-than-expected jump in September retail sales offset the  impact of falling insurance company shares.,2,Business
"Judge Defers Decision in Oracle Takeover Bid The dispute between Oracle and PeopleSoft will return to the courtroom next month, when the presiding judge will hear more testimony.",2,Business
"Iraq to get \$436m emergency loan The International Monetary Fund (IMF) has approved an emergency loan of \$436m (232m) to Iraq, the first from an international organisation.",2,Business
"Blue Chips End Lower, Earnings Disappoint  NEW YORK (Reuters) - U.S. blue-chips ended slightly lower  on Wednesday after Honeywell International Inc. &lt;A HREF=""http://www.investor.reuters.com/FullQuote.aspx?ticker=HON.N target=/stocks/quickinfo/fullquote""&gt;HON.N&lt;/A&gt; and  J.P. Morgan Chase   Co. &lt;A HREF=""http://www.investor.reuters.com/FullQuote.aspx?ticker=JPM.N target=/stocks/quickinfo/fullquote""&gt;JPM.N&lt;/A&gt; disappointed investors with  quarterly reports, and high oil prices rekindled worries about  the impact on corporate profit margins.",2,Business
"National Semiconductor to Sell Unit National Semiconductor Corp. said Monday it agreed to sell its imaging business, which makes chips used in small cameras and cell phones, to camera giant Eastman Kodak Co.",2,Business
"What can \$2-million do for your office? Michael Ovitz, who had a brief but extremely lucrative career as president of Walt Disney Co. in the mid 1990s, might emerge as the latest embodiment of corporate spending run amok.",2,Business
"US Fed set to serve up another small rate hike Federal Reserve officials are expected to nudge interest rates up on Tuesday for a fifth time this year, another small step in a campaign to gradually lift borrowing costs before inflation rears its head.",2,Business
"LIQUID DIET After the startling success of its turkey and gravy-flavoured soda during last year #39;s US holiday season, a Seattle soda company will be serving up green beans and casserole, mashed potatoes and butter, fruitcake and cranberry flavours.",2,Business
"BIG HIKE IN ENERGY BILLS The company says the record price of wholesale gas, which also effects the cost of electricity, is to blame. A spokesman said the increases would add an extra 7p a day to electricity bills.",2,Business
"Central bank bumps rate The Bank of Canada rate will hit four per cent by late next year, an economist predicts. OTTAWA -- The Bank of Canada raised its key policy interest rate yesterday while hinting that this could be the start of a new upward trend in borrowing costs.",2,Business
"Business hopes Bush will forgo tax reform By Andrew Balls, James Harding and Christopher Swann in Washington. US business has little appetite for fundamental tax reform, seeing deficit reduction and government entitlement programmes as priorities for President George W Bush #39;s second-term agenda.",2,Business
"Officials Blame Contractors in Tunnel Leak The tunnel containing this city #39;s sunken highway - the crown jewel of the Big Dig, Boston #39;s mammoth \$14.6 billion highway project - is leaking because of improper construction ",2,Business
"Update 3: CEO: Altria Preparing to Break Up Company Tobacco and food giant Altria Group Inc. is moving ahead with preparations to break itself up into two or three businesses, the company #39;s chairman and CEO said Thursday.",2,Business
"European Union to lift sanctions against United States BRUSSELS (Belgium): The European Union will lift sanctions against the United States now that US President George W. Bush has signed a law reforming corporate tax breaks deemed illegal by the World Trade Organisation, the EU executive commission said ",2,Business
"Cans of turkey luncheon meat recalled International Trading Co., of Houston, is voluntarily recalling about 73,590 additional pounds of turkey lunch meat due to possible underprocessing.",2,Business
"Shoppers still frugal lot The quartet, of course, represents the four hurricanes that raked across Florida in late August and the first half of September -- storms blamed for death, destruction and a dampening of retail sales as well.",2,Business
"Budget carrier AirAsia plans to order 40 A320 #39;s -report Airbus has beat rival Boeing Co. with an order from Malaysia #39;s budget-airline market, Air-Asia for as much as \$5.2 billion of A320 jetliners, according to a published report.",2,Business
"Sports Car Revamp Revs Up Porsche Sales German carmaker Porsche expects its streak of strong earnings to continue in the current fiscal year that ends in July, the company said on Wednesday.",2,Business
"Dollar Jumps as the G7 Fades The dollar surged against the euro, yen and Swiss franc on Monday as, with a Group of Seven rich nations meeting out of the way, the greenback was free to join a wave of optimism about the US economy.",2,Business
"PacifiCare to Buy American Medical  NEW YORK (Reuters) - PacifiCare Health Systems Inc. , one  of the biggest Medicare plan providers, said on Wednesday it  has agreed to buy health-care benefits provider American  Medical Security Group Inc. for \$502 million to expand its  product offerings to individuals and small businesses.",2,Business
"There are pledges and then there are real pledges Like introductory credit card rates and superior customer service, some promises just aren #39;t built to last. And so it is that Bank of America - mere months after its pledge to preserve ",2,Business
"Ameritrade Profit Up But Trading Slips  NEW YORK (Reuters) - Internet brokerage Ameritrade Holding  Corp. &lt;A HREF=""http://www.investor.reuters.com/FullQuote.aspx?ticker=AMTD.O target=/stocks/quickinfo/fullquote""&gt;AMTD.O&lt;/A&gt; said Tuesday its quarterly profit rose from a  year earlier, though trading revenue fell as investors curbed  trading activity in recent weeks.",2,Business
"Disney 4Q Earnings Rise to \$516 Million Walt Disney Co. said Thursday that profit jumped 24 percent in the fiscal fourth quarter, driven by growth at its television networks, theme parks and consumer products businesses.",2,Business
Trial Letdown Hits Possis Medical Shares of device maker Possis Medical (Nasdaq: POSS) are down 38 to \$19.20 after the company cut its fiscal 2005 earnings outlook after a trial involving its AngioJet blood clot treatment yielded disappointing results.,2,Business
"Consumers Fuel Faster Economic Growth (Reuters) Reuters - Robust consumer spending on cars,\furniture and food helped the U.S. economy advance faster than\first thought in the third quarter, a government report showed,\while underlying inflation was the tamest in decades.",2,Business
Deal to salvage troubled Alitalia ALITALIA bosses and unions along with the government today announced their agreement on a deal to salvage the troubled Italian flag-carrier.,2,Business
"Amazon Profit Misses Estimates Amazon.com Inc (AMZN.O: Quote, Profile, Research) on Thursday posted a higher quarterly profit but its stock fell more than 4 percent as the online retailer #39;s results failed to top Wall Street expectations.",2,Business
US elections polling begins today WASHINGTON: Polling for the US elections will begin according to Pakistan time at 5:00 pm on Tuesday as Americans vote in one of the closest presidential elections in decades after a long and often bitter campaign between Republican incumbent George W ,2,Business
Delta: Workers Sigh With Relief Workers at Delta Air Lines breathed a sigh of relief Thursday after hearing the news the airline #39;s pilots union agreed to \$1 billion in wage and benefits concessions.,2,Business
"Stocks to Watch Thursday (Reuters) Reuters - Stocks moving on Thursday: EXXON MOBIL\, ROYAL DUTCH PETROLEUM CO. :",2,Business
"Infosys, Wipro in pact with Microsoft Bangalore, Nov 15 (UNI) Indian IT majors Infosys Technologies and Wipro Ltd today announced separate agreements with Microsoft Corp, the world #39;s largest software maker, to deliver applications and solutions to their global customers based on Microsoft ",2,Business
AT amp;T posts \$7.1 billion loss Wired  amp; Wireless continues its reign at the top spot among IT priorities due to widespread IP telephony and wireless deployment.,2,Business
Salvation Army looks for new fundraising  quot;target quot; It #39;s going to be a little quieter outside of Target stores this holiday season. The company isn #39;t allowing the Salvation Army bell ringers outside its stores.,2,Business
"When a Utility Saves Money, Who Benefits? Customers of investor-owned electric utilities must cover all the expenses of these legal monopolies in the rates they pay. But what happens when a utility owner ",2,Business
EU judge considers impact of Microsoft dropouts A European Union judge has summoned all sides for a closed meeting today to consider how to handle the decision by two major opponents of Microsoft to drop out of an antitrust case against the company.,2,Business
Property Fund Says to Hold YUKOS Auction (Reuters) Reuters - Russia's Federal Property Fund said on\Friday it intended to go ahead with an auction of oil major\YUKOS' main unit Yuganskneftegaz despite a U.S. court decision\to freeze the state-imposed sale.,2,Business
"OPEC #39;s choices limited ahead of Wednesday meet OPEC will do all it can to show it wants to stabilize sky-high oil prices when the cartel meets here on Wednesday, but having already maximized production there is little more it can do to calm the markets.",2,Business
"Half of Mass. hospitals lost money Fifty-three percent of Massachusetts hospitals lost money on operations during the first six months of fiscal 2004, according to a Massachusetts Hospital Association survey. The lobbying group, which surveys its members' financial health yearly, found that, on average, hospitals posted slight losses on operations, but more than made that up on investments and from philanthropy. Operating margins improved slightly from ...",2,Business
Zale Reports Wider Third-Quarter Loss (AP) AP - Jewelry retailer Zale Corp. said its loss widened to  #36;10.9 million in its third quarter despite a slight rise in revenue.,2,Business
"US prices in surprise July slide US consumer prices  fell by 0.1 in July, the first fall this year, reducing the chances of a September interest rate rise.",2,Business
"Perrigo to Buy Agis, a Maker of Generic Prescription Drugs The Perrigo Company, the world #39;s largest maker of store-branded over-the-counter drugs, plans to announce today that it has reached an agreement to buy Agis Industries, a developer and ",2,Business
"Update 12: Bargain Shoppers Get Early Holiday Start Bargain shoppers, many of them braving chilly temperatures, woke up before dawn to head for the nation #39;s malls and stores Friday, the official beginning of the holiday shopping season, hoping to take advantage of early bird specials on a range of items ",2,Business
Qantas Says British Airways Sold Stake Qantas said Thursday that British Airways has sold its 18.25 percent stake in the Australian carrier at 3.28 Australian dollars (US\$2.,2,Business
Circuit City narrows 3Q loss Circuit City Stores Inc. on Friday reported a narrower third-quarter loss from continuing operations as sales of higher-margin warranties and improved distribution helped offset weak merchandise sales.,2,Business
Canada wins fight with US on wheat The World Trade Organization's top court handed Canadian wheat farmers another victory yesterday in their fight against US charges they are unfair traders.,2,Business
"Safety Group: Car, SUV Bumpers Don #39;t Line Up WASHINGTON -- An insurance group says low-speed crashes result in expensive repairs simply because of differences in the bumper height between cars and sport utility vehicles.",2,Business
The Money Man Alan greenspan #39;s official title is Chairman of the US Federal Reserve. But he functions as something akin to America #39;s economic Prognosticator in Chief.,2,Business
Mobile phone customers get connected Cingular Wireless marked the completion of its \$41 billion takeover of AT amp;T Wireless Services Inc. by immediately expanding unlimited mobile-to-mobile calling between the two networks. Subscribers of the original Cingular and AT amp;T Wireless who have had plans that gave them unlimited calls to fellow subscribers now also get free unlimited calls to subscribers of the other carrier. Cingular is now ...,2,Business
"Chrysler recalling 240,100 minivans DETROIT - Chrysler is recalling 240,000 minivans because the radios may short circuit and cause a fire, the automaker said Monday.",2,Business
"Chain Store Sales Slipped Latest Week (Reuters) Reuters - U.S. chain store retail sales slipped\during the Thanksgiving holiday week, as consumers took\advantage of discounted merchandise, a retail report said on\Tuesday.",2,Business
"Court Seen Lifting YUKOS Block -- Lawyers (Reuters) Reuters - A U.S. bankruptcy court is likely to\revoke its temporary ban on the sale of Russian oil group\YUKOS's main production unit, lawyers said on Friday.",2,Business
"Newsday trimming work force by 100 _ Newsday is cutting as many as 100 jobs through voluntary and non-voluntary buyouts, the Long Island newspaper #39;s publisher said Thursday.",2,Business
"Bush Picks Kellogg CEO for Commerce Post President Bush, left, announces that he has chosen Carlos Gutierrez, chief executive officer of the Kellogg Co., right, to be Secretary of Commerce, Monday, Nov. 29, 2004, in the Roosevelt Room of the White House.",2,Business
McGuinty Wants Kids in Classroom  Not Malls Students in Ontario will have to keep their nose in their books until they #39;re at least 18 years old. The province is set to propose new legislation next year that would make students stay in school until they #39;re 18-years-old.,2,Business
"SEC May Charge That AIG Lied to Investors  NEW YORK (Reuters) - American International Group Inc.  &lt;A HREF=""http://www.investor.reuters.com/FullQuote.aspx?ticker=AIG.N target=/stocks/quickinfo/fullquote""&gt;AIG.N&lt;/A&gt;, the world's largest insurer by market value, on Monday  said the U.S. Securities and Exchange Commission may take civil  action against it for issuing ""false and misleading"" statements  to investors.",2,Business
More petrol price rises feared Another round of petrol price rises could be looming after crude oil prices hit the \$US50 a barrel mark over the weekend. Oil prices are at their highest in more than 20 years due to supply concerns in Nigeria ,2,Business
"Cadbury Says Annual Results to Be at Low End of Range (Update4) Cadbury Schweppes Plc, the maker of 7Up and Dr Pepper, said 2004 earnings will be at the low end of forecasts as demand in the US and Europe stagnates, days after Coca-Cola Co.",2,Business
"Freddie Mac Restructuring Some Operations Freddie Mac will shut down the market-making operations of its securities sales and trading unit as it restructures some mortgage-securities operations, the government-sponsored home-mortgage company said Monday.",2,Business
"Holidays are a hit with thieves When most of us contemplate the holidays, we think of friends, family and fellowship. But Susan Larson has phishing on her mind. Larson works for SurfControl, an Internet and e-mail security company.",2,Business
"Gilead Sciences Profit Rises 55 Pct  LOS ANGELES (Reuters) - Gilead Sciences Inc. &lt;A HREF=""http://www.investor.reuters.com/FullQuote.aspx?ticker=GILD.O target=/stocks/quickinfo/fullquote""&gt;GILD.O&lt;/A&gt; on  Thursday said its quarterly net profit rose 55 percent on  increased sales of its HIV drugs.",2,Business
Blair: Don #39;t write people off at 65 The Prime Minister has waded into the pensions crisis by calling for people not to be  quot;written off quot; at the age of 65. He was speaking ahead of a long-awaited official report which is expected to show a multi ,2,Business
"Toyota, Honda, Nissan Lead Asians to Peak US Share (Update4) Toyota Motor Corp. and Nissan Honda Co. led Asian automakers to a record share of the US market in October as improved quality and fuel efficiency bolstered demand for their newest car and light truck models.",2,Business
"Oil prices climb towards 55 dollars LONDON (AFP) - World oil prices marched towards 55 dollars on worries about low stocks of US heating fuel and tight crude supplies, amid strong demand ahead of the northern hemisphere winter.",2,Business
"ExxonMobil, Qatar land LNG financing SAN FRANCISCO (CBS.MW) -- ExxonMobil Corp. and Qatar Petroleum said Wednesday they had lined up \$7.5 billion toward financing their giant Qatargas II project, which aims to export liquefied natural gas from the Middle East nation to Britain.",2,Business
"British house prices record sharpest fall in 9 years House prices in Britain fell at their steepest pace in nine years in the three months to September,adding to evidence that the property market is cooling and decreasing the possibility ",2,Business
"Dollar Falls, Gloom Over Economy Persists  NEW YORK (Reuters) - The dollar fell sharply on Monday,  dropping to within one cent of record lows against the euro as  worries over the state of the U.S. economy persisted.",2,Business
"Gambro Sells U.S. Kidney Clinics Unit  STOCKHOLM (Reuters) - Swedish kidney-care company Gambro AB  has signed an agreement to sell its U.S. clinics business to  dialysis firm DaVita Inc. for \$3.05 billion in cash, Gambro  said on Tuesday.",2,Business
"Airbus gets go-ahead to build new airliner The board of EADS, the parent company of Airbus, the aerospace giant, will tomorrow give the green light to develop its new aircraft, the A350.",2,Business
"Exxon Mobil Director Longwell to Retire Exxon Mobil Corp. said Monday that executive vice president and board member Harry J. Longwell, 63, plans to retire at the end of the year after serving nine years as a director and 41 years with the company.",2,Business
"US blue chips fall as oil prices rise, but Apple lifts Nasdaq NEW YORK : US blue chips ended lower on Monday on higher oil prices and an analyst downgrade of pharmaceutical giant Pfizer; but techs managed a small gain, helped by an upgrade for Apple Computer.",2,Business
"Yukos abandons its fight for survival Russia #39;s embattled oil giant Yukos raised the white flag and said it would seek  quot;liquidation or bankruptcy quot; after the forced government sale of its key oilfield next month, the company said yesterday.",2,Business
"Cingular works to certify Audiovox smart phone for its network Cingular Wireless LLC is testing Audiovox #39;s Windows Mobile smart phone for use on its network, a move indicative of the complications surrounding the carrier #39;s combination with AT amp;T Wireless Services Inc.",2,Business
