text,label,label_text
"Miner shares the wealth BHP Billiton, the world #39;s biggest miner, will buy back as much as A\$1.5 billion (\$1.6 billion) of its Australian stock as part of a plan to return profit from soaring commodity prices to investors.",2,Business
"Brown-Forman Earnings Jump 67 Percent Brown-Forman Corp. , which sells products ranging from Jack Daniels whiskey to Lenox china, on Thursday posted a better-than-expected 67 percent jump in earnings as aggressive marketing boosted sales of premium spirits and new wines.",2,Business
United Rentals Sees 3Q Goodwill Charge Equipment rental company United Rentals Inc. on Tuesday said it will likely report a non-cash charge in the third quarter to write down the goodwill of its suffering traffic control business.,2,Business
"Spokane diocese files for bankruptcy By becoming only the third diocese nationally to seek shelter in bankruptcy court, the Roman Catholic Diocese of Spokane is hoping the court will help provide a clearer picture of its financial liability in mounting sex-abuse lawsuits and goad its ",2,Business
"Progress Energy Cuts Earnings Outlook Because Of Hurricanes RALEIGH, NC -- Progress Energy says it will take nearly \$300 million to restore downed electrical lines, splintered utility poles and blasted transformers in hurricane-ravaged Florida.",2,Business
"Google Faces Challenge of Public Company Status Your name is synonymous with searching the Internet, and you #39;ve just raised roughly \$1.7 billion from investors by going public.",2,Business
Oil Back Up to \$55 on US Winter Stocks LONDON - Oil prices charged back up to \$55 a barrel this week as a fresh fall in US heating oil stocks stoked worries over winter supplies.,2,Business
"Electronics, Health Care Profit at Tyco #39;s electronics unit rose more than fourfold in the quarter as revenue climbed 15 percent on higher sales volume in automotive, communications, computer and consumer electronics.",2,Business
"Cendant to Buy Orbitz for  #36;1.25 Billion (Reuters) Reuters - Travel and real estate heavyweight\Cendant Corp.  said on Wednesday it will buy travel Web\site Orbitz Inc.  for about  #36;1.25 billion, making it\the No. 2 online travel agency.",2,Business
"Athlete's Foot Seeks Bankruptcy Protection (AP) AP - Sneaker retailer Athlete's Foot Stores LLC filed a voluntary Chapter 11 petition Thursday in the U.S. Bankruptcy Court in Manhattan, according to court papers.",2,Business
"Bank customers to lose 'float' time Horace Small knows it's a bad idea to write checks without enough money in the bank to cover them. But with property taxes and car insurance making huge dents in his income, the neighborhood organizer occasionally relies on the  quot;float quot; -- the two or three days it takes for checks to clear -- to juggle all of his payments.",2,Business
Former Merrill Executives Convicted in Enron Scam A jury convicted four former Merrill Lynch (MER:NYSE - news - research) executives and a former Enron employee of conspiracy and fraud in the first criminal trial involving employees of Wall Street and the once-beleaguered company.,2,Business
"IBM Exec May Become Computer Associates CEO Troubled business software company Computer Associates International Inc. has selected longtime IBM executive John Swainson as its new chief executive, The Wall Street Journal reported Monday.",2,Business
"Global Funds Offer Broad Exposure (AP) AP - With the U.S. economy likely to slow next year, many investors are looking to add more international exposure to their portfolios in hopes of winning higher returns. A number of global mutual funds offer what seems like easy one-stop shopping, but experts warn that all are not created equal.",2,Business
"Update 4: EU Head Office Trims 2005 Growth Forecast The European Union #39;s head office issued a bleak economic report Tuesday, warning that the sharp rise in oil prices will  quot;take its toll quot; on economic growth next year while the euro #39;s renewed climb could threaten crucial exports.",2,Business
"ATI Q4 sales, income rocket ATI saw its income almost triple during its most recently completed fiscal quarter, Q4 2004, the company said yesterday after announcing record results.",2,Business
"America's Largest Private Companies (Forbes.com) Forbes.com - Editors: Shlomo Reifman and Samantha N. Wong\Researchers: Joshua Brandt, Fei Mei Chan, \Andrew T. Gillies, Soo Jeong, Edward Knudsen, \Artie Kwok, John Ray and Jody Yen\Programmer: Carl Subick",2,Business
"Fed expected to deliver fifth quarter-point rate hike With a fall in oil prices easing inflation concerns, the Federal Reserve is expected to continue its easy-does-it approach to raising interest rates, boosting a key rate by a moderate quarter-point at its final meeting of the year Tuesday.",2,Business
"To tithe, make it first item in budget WASHINGTON -- Why is the subject of giving such a difficult thing to discuss? Some folks would rather ask someone for a kidney than for a donation to a charitable cause.",2,Business
T. Rowe Price Has Wind in Its Sails Can the mutual fund firm do well in a bad environment for financial services?,2,Business
"Dollar Slumps Broadly, More Losses Seen  NEW YORK (Reuters) - The dollar stumbled on Friday as  persistent concerns over the U.S. economy and comments  throughout the week from European Central Bank and Federal  Reserve officials allowed the currency no respite.",2,Business
"Oracle Q1 net up 16 Net income in the fiscal first-quarter rose to \$509 million, from \$440 million a year earlier, while revenue rose seven percent to \$2.",2,Business
"IGT posts lower quarterly profit, record yearly income Slot machine maker International Game Technology said Tuesday that fourth-quarter profit declined 50 percent from the same period a year earlier as a result of the early redemption ",2,Business
"Anheuser-Busch: World's Drinking More Bud  NEW YORK (Reuters) - Anheuser-Busch Cos. Inc. &lt;A HREF=""http://www.investor.reuters.com/FullQuote.aspx?ticker=BUD.N target=/stocks/quickinfo/fullquote""&gt;BUD.N&lt;/A&gt;, the  largest U.S. brewer, said on Wednesday quarterly profit rose  due to price increases on brands such as Bud Light and strong  growth in its international business, which benefited from the  acquisition of Harbin Brewery in China.",2,Business
"Federal Regulators Find Problems at 4 Big Auditors The new regulatory body for the auditing industry said that its inspections of the Big Four accounting firms had found ""significant audit and accounting issues.""",2,Business
"Oil Rebounds After Iraq Pipeline Attack  LONDON (Reuters) - Oil prices rose on Friday, stemming five  days of heavy losses as fresh sabotage attacks on Iraqi oil  infrastructure despite a peace deal in Najaf renewed concern  over the country's supplies.",2,Business
"US new home sales, loan supply to fall-Fannie CEO US new home sales and new mortgage supply are expected to fall in 2005, but will still run near historically high levels, said Franklin Raines, chief executive officer at Fannie Mae (FNM.",2,Business
"Japanese Bonds Fall as US Sales Figures Cool Export Concern Japanese 10-year bonds fell after a US report showed retail sales rose more than economists expected last month, damping concern demand for Japan #39;s goods will slow.",2,Business
"Before-the-Bell: Sanderson Farms Falls  NEW YORK (Reuters) - Shares of Sanderson Farms Inc.  &lt;A HREF=""http://www.investor.reuters.com/FullQuote.aspx?ticker=SAFM.O target=/stocks/quickinfo/fullquote""&gt;SAFM.O&lt;/A&gt; sunk nearly 16 percent before the bell on Tuesday,  after the chicken producer's quarterly earnings fell short of  Wall Street estimates.",2,Business
"Expanding economy confirmed With the economy continuing to rank as a top factor in the upcoming election, the latest  quot;beige book quot; confirms that economic activity continued to expand through early October.",2,Business
Unilever shares fall on warning Shares in Unilever fall after the Anglo-Dutch consumer goods giant issued a surprise profits warning.,2,Business
"3M Posts Higher Profit, Misses Estimates  CHICAGO (Reuters) - 3M Co. &lt;A HREF=""http://www.investor.reuters.com/FullQuote.aspx?ticker=MMM.N target=/stocks/quickinfo/fullquote""&gt;MMM.N&lt;/A&gt; on Monday said  third-quarter earnings rose 17 percent due in part to the weak  dollar, but the diversified manufacturer's results came in  below Wall Street's estimates for the first time in at least  seven quarters.",2,Business
"Report: Russian tycoon Roman Abramovich sells final stake in &lt;b&gt;...&lt;/b&gt; Basic Element, the holding company controlled by aluminum baron Oleg Deripaska, is close to acquiring full control of Russia #39;s biggest aluminum maker, Russian Aluminum, the Interfax news agency reported Friday.",2,Business
"Oil price at new record of above \$54 pb; Brent crosses \$51 pb NEW YORK, October 12 (newratings.com) - World crude oil prices continued their upward rally today above \$54 per barrel, rising to new record high levels for the sixth consecutive day.",2,Business
Oil Prices Slip Below  #36;46; Risks Abound (Reuters) Reuters - Oil prices fell  #36;1 below record highs\on Tuesday as fears over supply disruptions in Venezuela eased\after President Hugo Chavez won a vote on his rule.,2,Business
Applied Materials Signals Caution Applied Materials (AMAT:Nasdaq - news - research) posted sharply higher net income in its fiscal fourth quarter but said it had seen demand decelerate recently.,2,Business
"Shell Settles with SEC, UK for \$151 Mln  LONDON (Reuters) - Royal Dutch/Shell Group agreed on  Tuesday to finalized settlements with U.S. and UK regulators  which will cost the oil giant \$150.7 million over its  mis-statement of proven oil reserves.",2,Business
"More union givebacks unlikely at US Airways US Airways #39; unions, defying efforts to win labor concessions to avert a bankruptcy, are unlikely to give up pay and benefits under a threat of cuts imposed by a court, a labor leader and consultants said.",2,Business
Target getting bum rap for ending  #39;ringer #39; favoritism Target Corp. is being treated as the Grinch who stole Christmas because it bent its rules to play Santa Claus for Salvation Army bell-ringers for years -- to the tune of about \$9 million a year.,2,Business
"US Stocks Climb as Crude Oil Falls \$2 Stocks rose after US crude oil fell below \$50 a barrel on Monday, offsetting jitters ahead of an uncertain outcome for the US presidential election.",2,Business
"For long term, consider bonds over cash Q. I am 50 years old, employed at a good job, and have about \$2 million of investments, of which \$1.1 million is in cash equivalents. I have two kids, one of whom has \$150,000 in a Uniform Transfers to Minors account; the other has \$15,000. I am completely lost in terms of what to do. I have always been ...",2,Business
"Judge lets US Airways cut workers #39; pay by 21 ALEXANDRIA, Va. - A bankruptcy judge granted US Airways authority yesterday to immediately cut the pay of its union workers by 21 percent through mid-February, saying the airline #39;s situation is so dire that urgent action must be taken.",2,Business
"Tough Quarter for Circuit City Circuit City (CC:NYSE - news - research) Monday said same-store sales fell 4.3 in the third-quarter, attributing the decline to decreased promotions as well as weaker sales of music and movie software and wireless products.",2,Business
"New priority: SLC ponders ways to absorb Delta flights With January fast approaching, and with it the prospect of nearly 60 new Delta flights, Salt Lake City International Airport officials are rushing to absorb the increase.",2,Business
Shareholders Love a Little Hostility There's yet another hostile takeover in the tech sector's works.,2,Business
"OPEC: 'Very Small' Impact from Surge  LONDON (Reuters) - OPEC producers have said they see little  impact on economic growth so far from oil's relentless price  surge, which Wednesday racked up yet another record high.",2,Business
Taiwan Chip Giant Seeks Strong Partnerships The head of the world #39;s largest contract chip manufacturer said Thursday it will cost an estimated \$1 billion (euro 776 million) for his company to develop the latest chip production technology.,2,Business
"Exporters Lead Nikkei Up, Trade Slow The Nikkei average was up 0.37 percent in mid-morning trade on Thursday as a recovery in the dollar helped auto makers among other exporters, but trade was slow as investors waited for important Japanese economic data.",2,Business
"United, pilots tentatively agree on additional cuts United Airlines, seeking cost cuts to help it get out of bankruptcy, has reached a tentative agreement with its pilots union, the first labor accord on additional concessions the carrier proposed last month.",2,Business
IBM Seeks Settlement of Pension Lawsuit A US District Court Judge ruled last year that Big Blue had violated age-discrimination laws by amending its pension plan in a way that would make older employees accrue retirement benefits at a lower rate than younger workers.,2,Business
Mitsubishi Reports First Half Earnings Mitsubishi Motors Corp. said Monday that its losses grew in the first half of the fiscal year as the Japanese automaker struggled to recover from an auto-defect scandal that has sent sales plunging.,2,Business
"Intel lowers quarterly forecast Intel Corp., the world #39;s biggest maker of semiconductors, reduced its third-quarter revenue forecast Thursday, blaming lower-than-expected demand for flash memory and PC chips.",2,Business
"Mortgage Rates Hit 6-Month Low Freddie Mac said Thursday that 30-year mortgages have dropped to the lowest level since April 1, providing more of a boost to the housing industry.",2,Business
An Odyssey of Wealth Destruction The Merriam-Webster dictionary defines odyssey as  quot;a long wandering or voyage usually marked by many changes of fortune. quot; For hospice care provider Odyssey Healthcare (Nasdaq: ODSY ,2,Business
"U.S. Services Sector Slips, Jobs Mixed  NEW YORK (Reuters) - Growth in the vast U.S. services  sector slowed in September, but mixed data on employment on  Tuesday focused economists' attention on upcoming payrolls data  to get a clearer sign about the outlook.",2,Business
Monsanto Says Justice Dept Closes Inquiry (Reuters) Reuters - Monsanto Co. (MON.N) on Wednesday said\the U.S. Justice Department has closed an inquiry into\potential antitrust issues regarding a key ingredient used in\its Roundup herbicide.,2,Business
Russian beer advertisements canned Putin signs law restricting airtime and content in effort to curb his country #39;s alcohol intake. MOSCOW (Reuters) - A sweeping ban on beer advertising in Russia became law Tuesday in a move to curb the country #39;s ,2,Business
"Before the Bell: Krispy Kreme Down 11 Pct Shares of Krispy Kreme Doughnuts Inc. (KKD.N: Quote, Profile, Research) fell 11 percent before the bell on Monday after the struggling doughnut shop chain reported a quarterly net loss ",2,Business
"German welfare rallies escalate Eastern Germany sees more mass protests over welfare cuts, with smaller rallies in western cities.",2,Business
"Vauxhall Ellesmere Port Workers Facing Lay Offs LONDON, October 19 /PRNewswire/ -- Workers at the Vauxhall plant in Ellesmere Port, Merseyside are facing lay off tomorrow following strike action taken at the Bochum plant in Germany over the job losses announced there last week.",2,Business
BHP Billiton wins 3.2 billion dollar iron ore deal with Chinese &lt;b&gt;...&lt;/b&gt; SYDNEY : BHP Billiton said it had struck a 3.2 billion US dollar deal to supply four Chinese steel companies with iron ore over the next decade.,2,Business
"Online Search Universe Is Expanding To get an idea of how hot Web search is, go talk to Raul Valdes-Perez, a Carnegie Mellon University professor who is leading a search technology start-up called Vivisimo Inc.",2,Business
US OKs Emergency Oil Loan to 4th Refinery WASHINGTON - The Energy Department said last week it has approved another emergency oil loan to a refining company to make up for crude supplies disrupted by Hurricane Ivan.,2,Business
U.S. to Loan Strategic Reserve Crude Oil  NEW YORK (Reuters) - Two refiners will borrow crude oil  from the national emergency reserve to replace output lost due  to Hurricane Ivan and another oil major may be next to tap the  stockpile as prices near all-time highs.,2,Business
"No Marsh, Spitzer deal in  #39;04: WSJ Company said settlement for bid rigging claim likely this month, but says investigation is ongoing. NEW YORK (Reuters) - Marsh  amp; McLennan Cos.",2,Business
"Canada #39;s current account surplus shrinks OTTAWA - Canada #39;s current account surplus showed the first drop in almost two years in the third quarter, Statistics Canada said Monday.",2,Business
"Q amp;A Dr. Jeffrey M. Drazen on drug trial results The editors of 11 top medical journals shook up the staid world of academic publishing this past week when they decided to stop printing results of drug trials that aren't registered in a central database. Globe biotechnology reporter Jeffrey Krasner spoke with Dr. Jeffrey M. Drazen , editor-in-chief of the New England Journal of Medicine, about how the policy should ...",2,Business
Tokyo Stocks Climb to a Two-Week High  TOKYO (Reuters) - Tokyo stocks climbed to a two week high  on Friday after Tokyo Electron Ltd. and other chip-related  stocks were boosted by a bullish revenue outlook from industry  leader Intel Corp.,2,Business
Software Seeks Online Bargains Consumers in the United States are already spending record amounts of money online. One e-commerce company has a novel way to help Net shoppers hunt for bargains this holiday season.,2,Business
"Woolworths Has 16.6 Stake in Australian Leisure, Extends Offer Woolworths Ltd., Australia #39;s biggest grocer, increased its stake in takeover target Australian Leisure  amp; Hospitality Group to 16.",2,Business
"SEC Leaves Google Waiting on IPO Go Ahead NEW YORK/WASHINGTON (Reuters) - US regulators on Tuesday did not give Google Inc. the green light it needs to price its initial public offering, extending the wait for the Web search giant #39;s eagerly anticipated market ...",2,Business
Analysts: IBM selling PC business makes sense IBM is considering pulling out of the personal computer business it founded - a sign of a big change in the way companies buy computers and a shift of power in the PC industry.,2,Business
"UPDATE 1-Potlatch to sell \$457.5 mln in assets to Ainsworth Forest products company Potlatch Corp. (PCH.N: Quote, Profile, Research) said on Wednesday it agreed to sell certain plants and assets to Canada-based Ainsworth Lumber Co.",2,Business
"Boeing Wins Order From Singapore, Fails to Sell 7E7 (Update1) Boeing Co, the world #39;s second-biggest maker of commercial aircraft, won a \$3.6 billion order for 18 planes from Singapore Airlines Ltd.",2,Business
"President sees lead shrink on U of I Electronic Markets Iowa City, Ia. - President Bush #39;s lead in the University of Iowa-run Iowa Electronic Markets has shrunk in the past week with Democratic challenger Sen. John Kerry making a comeback among online investors, according to markets data on Friday.",2,Business
Merck sets up Vioxx review committee BOSTON (CBS.MW) -- Merck  amp; Co. said late Tuesday that it is establishing a committee to review its handling of the controversial withdrawal of its popular painkiller Vioxx from the market.,2,Business
"Delta Pilots Vote to Accept 32.5 Percent Pay Cut Pilots at Delta Air Lines overwhelmingly approved a new five-year contract today with \$1 billion in annual concessions sought by the airline, which had threatened to file for bankruptcy if the pilots did not acquiesce.",2,Business
"EU accuses Microsoft of paternalistic view : Microsoft Corp. today said that small companies and their customers would suffer most if it is forced to remove its digital media software from Windows, while the European Union accused ",2,Business
"Sex-bias suit filed against Costco A Costco Wholesale assistant manager sued the warehouse-club chain yesterday in federal court, alleging the company #39;s promotion policies keep women from seeking out the top two positions at its stores. ",2,Business
"Insurance industry misdeeds widening? In town to testify on bid rigging and price-fixing in the insurance industry, California Insurance Commissioner John Garamendi yesterday said ongoing investigations might reveal ",2,Business
"Ovitz Defends His Role in ABC Hiring, 'Kundun' GEORGETOWN, Del., Oct. 28 -- Plaintiffs in a shareholder lawsuit over former Walt Disney Co. president Michael Ovitz's \$140 million severance package attempted Thursday to portray Ovitz as a dishonest bumbler who botched the hiring of a major television executive and pushed the release of a movie that angered the Chinese government, damaging Disney's business prospects in the country.",2,Business
"By: DEBRA COTTERILL, Family and Consumers Sciences Agent Mason &lt;b&gt;...&lt;/b&gt; Many people who have never bounced a check in their life could soon bounce their first check if they write checks to pay bills a couple of days before their paycheck is deposited into their checking account.",2,Business
"Delta Up on Financing, Analyst Upgrades  CHICAGO (Reuters) - Shares of Delta Air Lines Inc. &lt;A HREF=""http://www.investor.reuters.com/FullQuote.aspx?ticker=DAL.N target=/stocks/quickinfo/fullquote""&gt;DAL.N&lt;/A&gt;  jumped 21 percent on Tuesday, as Wall Street analysts said the  possibility of a near-term bankruptcy diminished with the  carrier securing additional financing and intensifying  concession talks with its pilots.",2,Business
"Snap-On Ratchets Down Expectations The hand tool manufacturer beats estimates, but internal growth can't match competition.",2,Business
"Nokia makes Good on business phones com November 2, 2004, 11:06 AM PT. Wired  amp; Wireless continues its reign as the top IT priority among IT managers due to widespread IP telephony deployment and other network infrastructure upgrades.",2,Business
"ID Biomedical #39;s Shot in the Arm ID Biomedical (Nasdaq: IDBE) recently showed the importance of being in the right place at the right time, especially in the vaccine business.",2,Business
"Dixons and Sainsbury #39;s interims reveal lower sales High street and shopping mall retail chain Dixons Group, the UK #39;s largest consumer electronics and equipment retailer, has warned that sales and profits have waned in the last quarter.",2,Business
"Exchanges businesses, cash for 61.4 million shares LOS ANGELES (CBS.MW) -- Clorox Corp. said late Wednesday it will buy back Henkel KGaA #39;s 29 percent stake in the company in exchange for several businesses and \$2.",2,Business
"Attendants want  #39;reckless #39; UAL managers out Another United Airlines union is seeking to oust senior management at the troubled airline, saying its strategies are reckless and incompetent.",2,Business
"Boeing Sees EU Agreeing to End Launch Aid  WASHINGTON (Reuters) - A top Boeing Co. official said on  Friday he was optimistic the European Union would agree to end  government aid to develop new aircraft, which has helped its  chief rival Airbus grab more than half of the civil aircraft  market.",2,Business
"Federated #39;s 3Q beats Wall Street Federated Department Store Inc. posted better-than-expected earnings in the third-quarter of 2004 thanks to a sales rebound in Florida, where hurricanes had dampened sales in September.",2,Business
"Euro Reaches New High against Dollar The US dollar fell yesterday against all the major currencies on international exchange markets except the Canada dollar. The Euro climbed to \$1.3074 against US dollar, breaking a new record.",2,Business
"Singapore Air plans to buy 18 Boeing 777s Singapore Airlines Ltd, Asia #39;s most profitable carrier, may use new Boeing Co planes to try to win long-haul passengers from Emirates and Cathay Pacific Airways ",2,Business
Unocal to Settle Myanmar Lawsuits Unocal Corp. (UCL) has agreed to settle two closely watched lawsuits accusing the US oil giant of turning a blind eye to human rights abuses that occurred during the ,2,Business
"Pilots Playing Ball, Sign Delta Pact NOVEMBER 12, 2004 -- The union representing Delta Air Lines #39; pilots yesterday announced its membership had widely approved an agreement that cuts the carrier #39;s labor costs by \$1 billion annually.",2,Business
"eBay boss named most powerful businesswoman in US Meg Whitman of eBay has been named the most powerful woman in corporate America by Fortune magazine, toppling Carly Fiorina of Hewlett-Packard who had been at the top of the list since it began in 1998.",2,Business
"Unilateral action can stop the dollar #39;s slide The dollar has been trading at, or close to, its all-time low in European currency markets, prompting calls for the European Central Bank to intervene to stop the dollar #39;s slide against the euro.",2,Business
"Tropical Storm Otto forms on last day of hurricane season A low pressure system over the Central Atlantic has formed Tropical Storm Otto on the last day of hurricane season. At 4 pm, the center of Tropical Storm Otto was located near latituded 31.8 north, longitude 51 west or about 810 miles east of Bermuda.",2,Business
Electronic Arts reports higher 3Q But shares fall after the video game publisher cuts outlook for crucial Christmas shopping season. LOS ANGELES (Reuters) - Electronic Arts Inc.,2,Business
